{
  "schema_version":"1.0",
  "study_id":"technique-study-bilibili-BV1Gc411z7mu-v1",
  "generated_at":"2026-08-15T12:00:00Z",
  "source":{"source_id":"bilibili-BV1Gc411z7mu","url":"https://www.bilibili.com/video/BV1Gc411z7mu/","title":"我 求 婚 啦 ！！","duration_sec":1301.162167},
  "analysis_evidence":{"proxy_dual_stream_full_decode_exit_code":0,"video_duration_sec":1301.162167,"shot_count":405,"event_count":19,"audio_segment_count":444,"transcript_segment_count":501,"transcript_word_count":2316,"asr_provider":"faster-whisper","asr_model":"small","asr_language":"zh","asr_last_trusted_dialogue_end_sec":1301.12,"asr_dialogue_coverage_ratio":0.999968,"asr_tail_gap_sec":0.042167,"event_review_contact_sheet_count":19,"manual_review_ranges":[[0.0,342.6],[342.6,683.2],[683.2,1058.9],[1058.9,1301.162167]],"manual_review_focus":["cold-open-and-plan","song-writing-and-rehearsal","countdown-parallel-action","mv-performance-proposal-and-debrief"],"manual_effect_result":"未从人工画面证据确认 speed ramp、精确倍率、复杂转场机制、独立音效、精确 BPM 或逐拍剪切。"},
  "opening_recipe":{"total_reviewed_sec":71.9,"phases":[{"start_sec":0.0,"end_sec":8.0,"function":"先给求婚问句与接受反应，明确结果和情绪承诺。"},{"start_sec":8.0,"end_sec":39.0,"function":"回到当天独白，说明四年关系和为何不用擅长的视频而挑战写歌。"},{"start_sec":39.0,"end_sec":71.9,"function":"交代对方职业、伪装工作、场地、亲友与母亲到场等计划约束。"}],"metrics":{"opening_15_sec_shot_count":5,"opening_15_sec_average_shot_sec":4.128,"opening_event_count":1},"rule":"已知结果的私人事件片可用极短结果冷开场消除‘是否成功’悬念，把主要悬念转为‘如何完成’和关系细节。"},
  "narrative_model":{"premise":"创作者认为拍片太擅长，选择进入伴侣的唱演领域写一首原创歌求婚；影片从数月创作、场地与亲友准备、欺骗性工作安排和最后倒计时，推进到朋友合唱 MV、现场演唱、求婚与接受，最后用双方复盘解释暴露点、笨拙与四年关系。","beats":["结果冷开场和挑战设定","场地、亲友与假工作计划","数月写词编曲录音和反复排练","伴侣参观天文馆与求婚方准备并行","实时倒计时和临场风险","MV 朋友合唱与现场演唱","关系告白、求婚和接受","事后复盘、合影与下一阶段"],"rule":"重大私人事件以准备劳动、参与者关系和临场风险作为主体；结果之后保留双方复盘，使完美仪式重新落回真实关系。"},
  "scenic_model":{"preferred_sequence":["空场与布置建立空间","排练和走位说明未来动作","亲友进入形成关系尺度","投影、灯光、花与人物表情构成现场","以合影和离场收束"],"observed_ranges":[[71.9,221.6],[523.4,746.2],[1009.7,1301.162167]],"rule":"仪式空间的美感必须与布置劳动、走位、亲友和双方反应共同出现，不能只保留成品空镜。"},
  "music_model":{"music_likely_ratio":0.0653,"evidence_status":"manual_visual_evidence_of_original-song-writing-rehearsal-recording-and-live-performance","visual_candidates":["作词编曲讨论","乐队实录和合唱录音","朋友合唱 MV","现场演唱与告白"],"rule":"可学习原创歌从创作到现场 payoff 的叙事结构；不声明精确 BPM、调性、曲式、ducking、录音处理或逐拍剪切。"},
  "subtitle_model":{"base_style":"底部对白字幕配深色描边，距离求婚倒计时、日期、Demo/排练、歌词手写层和参与者身份独立呈现。","emphasis_patterns":["持续倒计时制造临场同步感","Demo、日期和排练标记说明准备跨度","MV 手写歌词与人物短片形成统一视觉层","求婚问句和片尾成功卡短暂放大"],"rule":"对白、歌词、倒计时与人员信息分层；未执行 OCR，歌词与文字准确性仍需人工听校。"},
  "humor_model":{"event_chain":["建立高压保密任务","保留唱歌失误、哭场、临时谎言、朋友吐槽和倒计时慌乱","让同伴协助修复并继续","事后由双方复盘暴露点"],"observed_ranges":[[136.4,616.3],[1009.7,1217.4]],"rule":"私人事件笑点来自自我暴露和熟人协作；不能以公开羞辱、操控同意或剪掉对方真实意愿换取效果。"},
  "technique_observations":[
    {"observation_id":"obs-proposal-result-cold-open-process-question","technique_key":"opening-result-cold-open-to-process-question","start_sec":0.0,"end_sec":71.9,"category":"opening_montage","trigger":"标题已经透露求婚，继续隐藏结果会制造廉价悬念。","treatment":"先给问句与接受反应，再回到当天独白，把悬念转为写歌、保密和亲友协作如何完成。","confidence":0.99,"parameters":{"result_revealed_first":true},"evidence":{"event_id":"event-001","manual_contact_sheet":true},"guardrails":["不得用冷开场歪曲对方完整意愿。","私人影像公开需双方同意。"]},
    {"observation_id":"obs-proposal-creation-iterations-payoff","technique_key":"narrative-creative-iterations-before-live-payoff","start_sec":136.4,"end_sec":342.6,"category":"narrative","trigger":"原创歌若只在现场出现，难以体现挑战和投入。","treatment":"保留数月写词、三版 Demo、编曲讨论、实录、唱功问题、反复排练和朋友纠正，再等待现场演唱。","confidence":0.98,"parameters":{"iterations_visible":true},"evidence":{"events":["event-003","event-004","event-005"],"manual_contact_sheets":true},"guardrails":["创作者和录音参与者署名授权需独立确认。","不由画面推断精确音乐参数。"]},
    {"observation_id":"obs-proposal-parallel-countdown","technique_key":"narrative-parallel-countdown-to-shared-event","start_sec":71.9,"end_sec":746.2,"category":"narrative","trigger":"求婚方准备与不知情伴侣的参观发生在同一时间。","treatment":"交叉剪辑天文馆假工作、场地布置、亲友集合、电话和实时距离倒计时，让两条线在入场时汇合。","confidence":0.99,"parameters":{"parallel_threads":2,"countdown_visible":true},"evidence":{"events":["event-002","event-006","event-007","event-008","event-009","event-010"],"manual_contact_sheets":true},"guardrails":["倒计时必须来自真实时间线。","不泄露无关人员实时位置或隐私。"]},
    {"observation_id":"obs-proposal-countdown-context-layer","technique_key":"subtitle-time-card-compresses-waiting","start_sec":71.9,"end_sec":746.2,"category":"subtitle","trigger":"数月准备与当天分钟级同步容易失去时间位置。","treatment":"用日期、距求婚天数/小时/分钟和短状态卡定位创作、彩排、抵达与全部就位。","confidence":0.97,"parameters":{"multi_scale_countdown":true},"evidence":{"events":["event-002","event-003","event-004","event-005","event-007","event-008","event-009","event-010"],"manual_contact_sheets":true},"guardrails":["时间卡不得伪造紧迫性。","字幕不得遮挡手机、走位和人物表情。"]},
    {"observation_id":"obs-proposal-community-chorus-memory-montage","technique_key":"graphic-community-chorus-memory-montage","start_sec":746.2,"end_sec":1009.7,"category":"graphic","trigger":"告白需要证明关系不仅存在于两位主角的独白。","treatment":"把朋友合唱录音、共同生活短片、宠物与旅行片段统一进手写歌词 MV，在现场播放前形成群体见证。","confidence":0.98,"parameters":{"community_voices":true,"memory_archive":true},"evidence":{"events":["event-011","event-012","event-013","event-014"],"manual_contact_sheets":true},"guardrails":["所有私人片段、歌词和参与者需授权。","朋友素材不能替代双方关系表达。"]},
    {"observation_id":"obs-proposal-performance-vow-answer","technique_key":"narrative-performance-vow-answer-payoff","start_sec":1009.7,"end_sec":1281.2,"category":"narrative","trigger":"准备线需要由真实现场和明确同意完成。","treatment":"按入场、现场演唱、承认笨拙、四年回顾、告白、求婚问句、明确回答、戴戒指和亲友合影完整保留。","confidence":0.99,"parameters":{"explicit_answer_retained":true},"evidence":{"events":["event-015","event-016","event-017","event-018"],"manual_contact_sheets":true},"guardrails":["明确回答与对方自主性不可删改。","情绪和亲友反应不得通过错序伪造。"]},
    {"observation_id":"obs-proposal-post-event-debrief","technique_key":"narrative-post-event-debrief-restores-authenticity","start_sec":1058.9,"end_sec":1301.162167,"category":"narrative","trigger":"精心制作的仪式容易显得过度完美。","treatment":"在求婚前后保留真唱/假唱、戒指尺寸、暴露风险、竞争对手玩笑、双方笑场和片尾花絮。","confidence":0.98,"parameters":{"debrief_after_payoff":true},"evidence":{"events":["event-016","event-017","event-018","event-019"],"full_transcript":true},"guardrails":["复盘不能削弱明确同意。","私人细节公开需双方确认。"]}
  ],
  "context_packet":{"packet_kind":"bounded_reference_context","serialized_characters":70013,"serialized_utf8_bytes":75767,"maximum_characters":180000,"character_comparison":"strictly_less_than","final_responses_request":{"serialized_characters":80845,"serialized_utf8_bytes":86599,"maximum_utf8_bytes":200000,"byte_comparison":"strictly_less_than","body_sha256":"2f2017bb224d4139e557ed612ed599f288c65ec04a2a4400b99ae10d1f8995c2","contains_model":true,"contains_instructions":true,"contains_input":true,"contains_tools":true,"contains_text_json_schema":true,"validation_scope":"exact UTF-8 byte gate and minimum Responses structure; no external model call was made"}},
  "limitations":["参考成片只提供正向保留模式，不能推断作者真实删片偏好。","人工画面未确认 speed ramp、精确倍率、复杂转场机制、独立音效、精确 BPM 或逐拍剪切。","未执行 OCR，字幕、歌词、倒计时、人员和片尾文字仍需人工复核。","可见原创歌创作、录音和现场演唱，但不声明曲式、调性、BPM、ducking 或音频处理。","私人影像、亲友、场地、音乐和品牌素材需确认授权。","求婚、健康和关系表达属于当事人个人经验，不能作为普遍关系建议。"]
}
