{
  "schema_version":"1.0",
  "study_id":"technique-study-bilibili-BV1Gt1FBPEum-v1",
  "generated_at":"2026-08-15T16:30:00+08:00",
  "source":{"source_id":"bilibili-BV1Gt1FBPEum","url":"https://www.bilibili.com/video/BV1Gt1FBPEum/","title":"那些劝你来新疆的人，根本没告诉你……","duration_sec":1471.616},
  "analysis_evidence":{"proxy_dual_stream_full_decode_exit_code":0,"video_duration_sec":1471.616,"shot_count":530,"event_count":16,"audio_segment_count":337,"transcript_segment_count":793,"transcript_word_count":4565,"asr_provider":"faster-whisper","asr_model":"small","asr_language":"zh","asr_last_trusted_dialogue_end_sec":1465.46,"asr_dialogue_coverage_ratio":0.995816,"asr_tail_gap_sec":6.156,"event_review_contact_sheet_count":16,"manual_review_ranges":[[0.0,407.5],[407.5,777.2],[777.2,1149.6],[1149.6,1471.616]],"manual_review_focus":["opening-place-and-pink-light-mission","livestock-bazaar-market-process","kashgar-old-city-local-encounters","karakoram-road-and-lake-geography","weather-wait-pink-light-payoff","closing-memory-and-credits"],"manual_effect_result":"16 张事件联系表确认底部对白字幕、少量地点/价格/科学解释图层、竖屏素材 inset、调色板与旧素材回看；未确认 speed ramp、精确倍率、复杂转场机制、独立音效、曲名、BPM、ducking 或逐拍剪切。"},
  "opening_recipe":{"total_reviewed_sec":107.4,"phases":[{"start_sec":0.0,"end_sec":24.0,"function":"以天山、帕米尔和喀什绿洲的航拍/远景建立南疆地理尺度。"},{"start_sec":24.0,"end_sec":64.0,"function":"主持人在喀什出场，提出人文拍摄之外为粉色车寻找‘粉调/粉色时刻’同框的品牌任务。"},{"start_sec":64.0,"end_sec":107.4,"function":"解释粉色光出现的多重天气条件和两位主持人的坏天气历史，把目的地魅力转为不确定任务。"}],"metrics":{"opening_15_sec_shot_count":8,"opening_15_sec_average_shot_sec":2.037,"opening_event_count":1},"rule":"地点片开场先用地理尺度建立目的地，再提出可验证、受天气约束的具体拍摄任务；品牌目标必须同时服务真实旅程问题。"},
  "narrative_model":{"premise":"72 小时南疆自驾以喀什人文和寻找雪山粉色时刻两条线推进：先在牛羊大巴扎通过商品、交易、砍价和人物互动理解城市，再进入古城巷道、舞蹈、建筑与生活；随后沿喀拉昆仑公路经过白沙湖抵达慕士塔格峰，在云层、寒冷、机位和等待的不确定性中完成短暂粉色光任务，最后把品牌委托收束为‘先出发’的个人旅行起点。","beats":["帕米尔地理与粉色拍摄任务","牛羊大巴扎的尺度、交易与砍价","舞蹈学习和古城生活纹理","告别喀什转入喀拉昆仑公路","白沙湖风景与天气风险","解释粉色形成条件并选定机位","延时遗漏、寒冷和长时间等待","粉色雪山与车身同框兑现","旧素材回看和先出发价值收束"],"rule":"将人文观察和天气依赖的视觉任务交替推进；任务结果之前保留市场过程、在地互动、路线变化、技术解释和等待成本，成功后再回到旅程价值。"},
  "scenic_model":{"preferred_sequence":["航拍或远景建立山脉与绿洲尺度","市场和古城以人物、交易、纹样及生活细节进入","车内路线和窗外地貌连接人文与自然","湖、雪山、人物和摄影机同框交代等待位置","短暂光线变化按普通景别、人物反应和任务同框兑现"],"observed_ranges":[[0.0,107.4],[496.1,777.2],[777.2,1038.3],[1149.6,1362.5]],"rule":"大景必须与人物行动、路线、天气和现场反应共同出现；天气依赖的美景需要保留等待和短暂性，不能伪装成随时可复制的结果。"},
  "music_model":{"music_likely_ratio":0.0314,"evidence_status":"audio-classification-and-manual-visual-review-only","visual_candidates":["地理开场与路线转场","古城纹样和人物观察","公路、湖泊与雪山建立镜头","粉色光兑现和结尾回忆蒙太奇"],"rule":"音乐适合支撑无对白地理段、路线桥和结果蒙太奇；市场交易、技术解释、等待对话与人物反应应优先保护现场声和对白。不声明曲名、BPM、ducking 或逐拍因果。"},
  "subtitle_model":{"base_style":"底部对白字幕为主，地点、价格、任务条件、天气/色彩解释和旧素材年份使用稀疏的独立信息层。","emphasis_patterns":["地点标题标记喀什、白沙湖和帕米尔路线","价格标签强化市场砍价过程","粉色形成条件和调色板帮助理解任务","旧素材录制框与年份说明旅程长期愿望"],"rule":"对白字幕保持稳定；解释图层只在当前画面需要证据时出现，品牌与科学信息必须可核验。未执行 OCR，文字准确性仍需人工听校。"},
  "humor_model":{"event_chain":["建立市场、舞蹈、摄影或等待的真实任务","保留砍价失误、摸牛、学动作、昵称互逗、忘开延时和御寒狼狈","让同伴或当地人物即时纠正和回应","快速回到地点观察或任务进度"],"observed_ranges":[[107.4,606.6],[671.5,935.3],[1038.3,1216.3]],"rule":"旅行笑点来自真实笨拙、伴侣互动和任务摩擦；不能以族群刻板印象、偷拍、隐私暴露或危险行为换取效果。"},
  "technique_observations":[
    {"observation_id":"obs-xinjiang-opening-place-mission","technique_key":"opening-place-thesis-to-concrete-mission","start_sec":0.0,"end_sec":107.4,"category":"opening_montage","trigger":"广阔目的地容易只形成泛化风景宣传，品牌露出也可能脱离旅程。","treatment":"先以天山、帕米尔和喀什绿洲建立南疆尺度，再提出为粉色车寻找雪山粉色时刻同框的天气依赖任务。","confidence":0.98,"parameters":{"place_thesis":"south_xinjiang_humanity_and_geography","mission":"weather_dependent_pink_light_frame"},"evidence":{"event_id":"event-001","manual_contact_sheet":true,"full_transcript":true},"guardrails":["品牌委托和产品关系需明确披露。","地理、天气与光学解释需独立核验。"]},
    {"observation_id":"obs-xinjiang-market-economic-process","technique_key":"narrative-economic-system-through-market-process","start_sec":107.4,"end_sec":496.1,"category":"narrative","trigger":"只拍市场奇观、食物和人群无法解释它如何运转。","treatment":"从商品尺度和价格进入牛羊交易区，保留看牙口、议价手势、现场风险和主持人实际砍价，再回到人与人交往的地方意义。","confidence":0.96,"parameters":{"market_process_visible":true,"host_transaction":true},"evidence":{"events":["event-002","event-003","event-004","event-005"],"manual_contact_sheets":true,"full_transcript":true},"guardrails":["交易规则、价格和经济学解释需独立核验。","不得以异域化镜头替代参与者尊严和语境。"]},
    {"observation_id":"obs-xinjiang-local-encounters","technique_key":"narrative-small-local-encounter-validates-place","start_sec":407.5,"end_sec":671.5,"category":"narrative","trigger":"旁白对古城文化的概括缺少当下生活证据。","treatment":"保留商贩砍价、当地姑娘教舞蹈与问候、巷道居民生活、猫和门砖细节，让具体互动承担地方感。","confidence":0.95,"parameters":{"encounter_types":["market","dance","street_life"]},"evidence":{"events":["event-005","event-006","event-007"],"manual_contact_sheets":true},"guardrails":["人物拍摄与公开需获得合适授权。","门、砖、语言和习俗解释需由可靠来源核验。"]},
    {"observation_id":"obs-xinjiang-product-mission-friction","technique_key":"narrative-sponsor-demonstration-with-host-friction","start_sec":671.5,"end_sec":1362.5,"category":"narrative","trigger":"产品若只在结果美景中出现，会与旅行叙事割裂。","treatment":"把车辆颜色任务、后备箱语音、车内磁吸位、长途驾驶、天气风险、机位设置、忘开延时和最终同框分散嵌入真实行动。","confidence":0.94,"parameters":{"demonstration_with_real_task":true,"friction_retained":true},"evidence":{"events":["event-008","event-009","event-011","event-012","event-015"],"manual_contact_sheets":true},"guardrails":["不由成片推断未展示的产品能力。","品牌信息、道路安全和驾驶画面需独立审查。"]},
    {"observation_id":"obs-xinjiang-road-geography-reaction","technique_key":"scenic-human-reaction-to-landmark-geography","start_sec":777.2,"end_sec":1038.3,"category":"scenic","trigger":"连续公路、湖泊和雪山远景容易缺少尺度与抵达感。","treatment":"以车内路线说明连接窗外荒山、绿洲和雪峰，在白沙湖保留停车、风、牦牛、天气担忧与两人反应，再继续追踪雪山目标。","confidence":0.97,"parameters":{"route_bridge":true,"human_scale":true},"evidence":{"events":["event-009","event-010","event-011"],"manual_contact_sheets":true},"guardrails":["不得把不同地点错序为同一连续路段。","道路、海拔、动物和天气安全需独立确认。"]},
    {"observation_id":"obs-xinjiang-wait-weather-payoff","technique_key":"scenic-weather-dependent-wait-to-brief-payoff","start_sec":935.3,"end_sec":1362.5,"category":"scenic","trigger":"粉色光只有短暂出现，若直接给结果会让任务显得无成本且可复制。","treatment":"先解释光线和雪山条件，保留云层风险、选点、架机、忘开延时、寒冷与持续等待，再按水面变粉、雪山变粉、人物反应和车身同框兑现约五分钟结果。","confidence":0.98,"parameters":{"uncertain_weather":true,"waiting_visible":true,"brief_payoff":true},"evidence":{"events":["event-011","event-012","event-013","event-014","event-015"],"manual_contact_sheets":true,"full_transcript":true},"guardrails":["粉色持续时间和形成条件需独立核验。","不得通过错序或调色伪造天气事件。"]},
    {"observation_id":"obs-xinjiang-real-task-humor","technique_key":"humor-preserve-real-awkward-process","start_sec":107.4,"end_sec":1216.3,"category":"humor","trigger":"人文和摄影任务信息密度高，需要人物过程提供呼吸。","treatment":"保留羊屁股玩笑、交易区躲牛、实际砍价、学舞蹈、昵称互逗、牦牛议价、忘开延时后的倒计时奔跑和披毯等待。","confidence":0.96,"parameters":{"humor_source":"real_task_friction"},"evidence":{"events":["event-002","event-004","event-005","event-006","event-010","event-012","event-013"],"manual_contact_sheets":true},"guardrails":["不得用族群、口音或偷拍作为笑点。","危险和高海拔不适不应被弱化。"]},
    {"observation_id":"obs-xinjiang-subtitle-context-layer","technique_key":"subtitle-base-dialogue-with-sparse-context-layer","start_sec":0.0,"end_sec":1471.616,"category":"subtitle","trigger":"路线、人文、交易、光学条件和品牌任务同时存在，纯对白字幕难以定位信息层级。","treatment":"保持底部对白字幕稳定，只在地点、价格、任务条件、调色板、录制年份和结尾标题处增加稀疏上下文层。","confidence":0.94,"parameters":{"base_layer":"bottom_dialogue","context_layers":["place","price","science","archive_year"]},"evidence":{"events":["event-003","event-010","event-012","event-015","event-016"],"manual_contact_sheets":true},"guardrails":["未执行 OCR，字幕与图卡文字仍需人工听校。","品牌、价格和科学文字必须绑定可核验证据。"]},
    {"observation_id":"obs-xinjiang-end-journey-closure","technique_key":"narrative-end-of-journey-montage-verbal-closure","start_sec":1249.1,"end_sec":1471.616,"category":"narrative","trigger":"品牌任务完成后若立刻结束，会把首次新疆旅程缩成一次交付。","treatment":"在粉色任务兑现后保留五分钟短暂性、三天预留和首次成功，再回看过去想去新疆的旧素材，以‘先出发’、72 小时坐标原点和未来重返完成口头收束。","confidence":0.97,"parameters":{"mission_to_personal_value":true,"archive_callback":true},"evidence":{"events":["event-015","event-016"],"manual_contact_sheets":true,"full_transcript":true},"guardrails":["旧素材、人物和品牌内容需确认授权。","个人旅行价值不能替代目的地事实与安全信息。"]}
  ],
  "context_packet":{"packet_kind":"bounded_reference_context","serialized_characters":80386,"serialized_utf8_bytes":91082,"maximum_characters":180000,"character_comparison":"strictly_less_than","final_responses_request":{"serialized_characters":92173,"serialized_utf8_bytes":102869,"maximum_utf8_bytes":200000,"byte_comparison":"strictly_less_than","body_sha256":"5b7ebfb386a52f7dce1e6ba5817c69c0262c5b9fcdc72be8b8e05ac529bdff33","contains_model":true,"contains_instructions":true,"contains_input":true,"contains_tools":true,"contains_text_json_schema":true,"validation_scope":"exact UTF-8 byte gate and minimum Responses structure; no external model call was made"}},
  "limitations":["参考成片只提供正向保留模式，没有原始素材与成片映射，不能推断作者真实删片偏好。","人工画面未确认 speed ramp、精确倍率、复杂转场机制、独立音效、曲名、BPM、ducking 或逐拍因果。","未执行 OCR，字幕、地点、价格、光学解释、品牌图层、年份和片尾文字仍需人工复核。","新疆地理、民族文化、交易方式、建筑、道路、天气、光学、动物与安全信息需独立核验。","品牌委托、车辆功能、颜色来源和产品表达需按广告、授权与事实要求另行审查。","现场人物、舞蹈教学、市场交易、旧素材和私人互动需确认拍摄与公开授权。","粉色光与最终同框是本次成片记录的正向结果，不代表相同地点、季节或天气能够复现。"]
}
