{
  "schema_version":"1.0",
  "study_id":"technique-study-bilibili-BV1uC411E7jU-v1",
  "generated_at":"2026-08-15T10:00:00Z",
  "source":{"source_id":"bilibili-BV1uC411E7jU","url":"https://www.bilibili.com/video/BV1uC411E7jU/","title":"花费15万的，北欧滤镜破碎之旅!","duration_sec":1176.788833},
  "analysis_evidence":{"proxy_dual_stream_full_decode_exit_code":0,"video_duration_sec":1176.788833,"shot_count":369,"event_count":15,"audio_segment_count":315,"transcript_segment_count":660,"transcript_word_count":3611,"asr_provider":"faster-whisper","asr_model":"small","asr_language":"zh","asr_last_trusted_dialogue_end_sec":1176.72,"asr_dialogue_coverage_ratio":0.999942,"asr_tail_gap_sec":0.068833,"event_review_contact_sheet_count":15,"manual_review_ranges":[[0.0,349.8],[349.8,660.0],[660.0,986.5],[986.5,1176.788833]],"manual_review_focus":["expectation-and-cost-opening","cancelled-activities-and-cold","weather-failure-and-wait","scenic-payoff-and-relationship-ending"],"manual_effect_result":"未从人工画面证据确认 speed ramp、精确倍率、复杂转场机制、独立音效或逐拍剪切。"},
  "opening_recipe":{"total_reviewed_sec":109.2,"phases":[{"start_sec":0.0,"end_sec":28.0,"function":"先给高价、狭小住宿、严寒和崩溃反应，直接承诺‘滤镜破碎’。"},{"start_sec":28.0,"end_sec":72.0,"function":"交代新婚旅行、观众推荐和挪威十五天路线。"},{"start_sec":72.0,"end_sec":109.2,"function":"用摄影期待与抵达后的脏雪、雨天形成第一次现实落差。"}],"metrics":{"opening_15_sec_shot_count":7,"opening_15_sec_average_shot_sec":2.474,"opening_event_count":1},"rule":"反滤镜旅行片应先给具体代价与反应，再说明原期待；正文必须完整兑现失败过程和少量真正回报。"},
  "narrative_model":{"premise":"影片以高价北欧摄影蜜月的期待为起点，连续呈现物价、住宿误判、项目取消、严寒、无雪与坏天气五类现实阻碍；夫妻通过长时间等待换来数小时晴雪，但最终最深记忆不是大片，而是做饭、逛超市、救车和互相照顾。","beats":["观众推荐与摄影天堂期待","抵达脏雪和高物价","住宿、驯鹿、观鹰、骑马连续落差","罗弗敦无雪与天气失败","暴雪后继续等待","短暂晴雪完成摄影回报","从大片转向夫妻日常记忆","花絮和下一期钩子"],"rule":"失败型旅行叙事要让每个阻碍留下原因、成本、人物反应和后续选择；景观 payoff 之后再回看关系变化，避免只做苦难清单。"},
  "scenic_model":{"preferred_sequence":["先呈现天气和交通限制","人物在严寒、风雪或等待中行动","宽景建立峡湾与雪山尺度","细节和人物反应证明拍摄代价","用短暂晴窗与后续日常解释价值"],"observed_ranges":[[349.8,586.2],[660.0,986.5],[986.5,1144.0]],"rule":"极地美景必须保留天气窗口、等待、装备与人物代价；不能把偶然晴天剪成全程顺利。"},
  "music_model":{"music_likely_ratio":0.0527,"evidence_status":"machine_audio_classification_only","visual_candidates":["开场失败预告","海鹰与骑马行动","暴雪等待","晴雪峡湾 payoff"],"rule":"不由联系表声明曲名、BPM、ducking、逐拍剪切或音乐因果。"},
  "subtitle_model":{"base_style":"底部对白字幕配深色描边，Day 卡、价格换算、项目编号、地点和天气使用独立图形层。","emphasis_patterns":["高价与预算用大数字短提示","五次崩溃用序号形成进度","Day 与天气卡帮助等待段定位","下一期钩子与片尾名单独立收束"],"rule":"价格、天气、地点和外语名词需与对白层分离；未执行 OCR，文字准确性仍需人工听校。"},
  "humor_model":{"event_chain":["先建立昂贵或浪漫期待","完整保留取消、脏雪、动物失控、冻哭和自我安慰","让伴侣互相吐槽并继续行动","在结果或回看时给关系层回声"],"observed_ranges":[[109.2,413.1],[515.8,795.5],[986.5,1176.788833]],"rule":"倒霉笑点必须带真实成本、恢复与安全边界；严寒、动物和工作人员不能被剪成单向嘲弄。"},
  "technique_observations":[
    {"observation_id":"obs-norway-opening-cost-failure-promise","technique_key":"opening-contrast-thesis-with-concrete-question","start_sec":0.0,"end_sec":109.2,"category":"opening_montage","trigger":"北欧美景预期过强，观众需要知道本片为何反向叙述。","treatment":"先并列高价、狭小住宿、严寒和人物崩溃，再交代蜜月与摄影期待，以脏雪抵达完成首次反差。","confidence":0.98,"parameters":{"failure_examples_before_route":true},"evidence":{"event_id":"event-001","manual_contact_sheet":true},"guardrails":["费用和行程需保留币种与时间语境。","不能把偶发问题概括为整个地区。"]},
    {"observation_id":"obs-norway-five-failures-spine","technique_key":"graphic-mission-checklist-progress-reward","start_sec":109.2,"end_sec":889.3,"category":"graphic","trigger":"连续倒霉事件容易散成重复抱怨。","treatment":"用五次‘崩溃时刻’编号串起物价、住宿、项目取消、动物行程和天气失败，并在后文回收。","confidence":0.96,"parameters":{"numbered_failures":5},"evidence":{"events":["event-002","event-003","event-004","event-005","event-008","event-010","event-011"],"manual_contact_sheets":true},"guardrails":["编号只组织事件，不伪造因果。","同类抱怨需去重但保留升级差异。"]},
    {"observation_id":"obs-norway-failure-adaptation-sun-window","technique_key":"narrative-failure-adaptation-payoff","start_sec":239.2,"end_sec":1074.5,"category":"narrative","trigger":"项目取消、无雪和持续坏天气不断推翻摄影计划。","treatment":"保留取消原因、改做活动、长时间等待和多次失望，直到短暂晴雪窗口兑现景观，再说明窗口迅速消失。","confidence":0.99,"parameters":{"failure_visible":true,"wait_before_payoff":true},"evidence":{"events":["event-004","event-005","event-006","event-009","event-010","event-011","event-012","event-013"],"manual_contact_sheets":true},"guardrails":["天气和项目取消信息需独立核验。","不能删掉装备、严寒与安全代价。"]},
    {"observation_id":"obs-norway-awkward-process-chain","technique_key":"humor-preserve-real-awkward-process","start_sec":109.2,"end_sec":889.3,"category":"humor","trigger":"高价、脏雪、驯鹿、快艇、骑马与天气持续制造非预期反应。","treatment":"保留期待、失败动作、伴侣吐槽、恢复和继续尝试的完整链条，而非只截取崩溃表情。","confidence":0.98,"parameters":{"setup_reaction_recovery":true},"evidence":{"events":["event-002","event-004","event-005","event-006","event-007","event-008","event-011"],"manual_contact_sheets":true},"guardrails":["冻伤、动物和海上活动安全优先。","工作人员和当地生活不作为笑料。"]},
    {"observation_id":"obs-norway-hardship-earned-scenic-payoff","technique_key":"scenic-hardship-earned-lake-payoff","start_sec":660.0,"end_sec":1074.5,"category":"scenic","trigger":"罗弗敦经典视角在无雪、暴雪和低能见度下无法拍摄。","treatment":"先展示空景、暴雪、等待和低能见度，再在短暂蓝天窗口给宽景、航拍、合影和人物急迫反应。","confidence":0.98,"parameters":{"weather_wait_visible":true},"evidence":{"events":["event-009","event-010","event-011","event-012","event-013"],"manual_contact_sheets":true},"guardrails":["美景镜头不能掩盖天气风险。","航拍规则与地点需独立核验。"]},
    {"observation_id":"obs-norway-spectacle-to-relationship-reframe","technique_key":"narrative-return-to-opening-value-question","start_sec":986.5,"end_sec":1144.0,"category":"narrative","trigger":"十五天只换来数小时理想画面，单以出片衡量会让旅程显得失败。","treatment":"在晴雪 payoff 后让夫妻分别回答最深记忆，把答案转向做饭、逛超市、救车和互相照顾。","confidence":0.99,"parameters":{"spectacle_reframed_by_private_memory":true},"evidence":{"events":["event-013","event-014"],"full_transcript":true},"guardrails":["关系结论必须保留双方原声。","不能用情绪收束否认真实费用与困难。"]},
    {"observation_id":"obs-norway-dialogue-price-weather-layers","technique_key":"subtitle-base-dialogue-with-sparse-context-layer","start_sec":0.0,"end_sec":1176.788833,"category":"subtitle","trigger":"价格、币种、Day、天气、项目、地点和动物名密集。","treatment":"维持底部对白层，将价格换算、Day、天气、地点、项目编号和动物知识放入独立稀疏层。","confidence":0.92,"parameters":{"base_position":"bottom_center","ocr_verified":false},"evidence":{"manual_contact_sheet_count":15},"guardrails":["价格、天气、外语名和物种仍需人工听校与事实核验。","图层不得遮挡动物动作、道路和人物表情。"]}
  ],
  "context_packet":{"packet_kind":"bounded_reference_context","serialized_characters":76655,"serialized_utf8_bytes":85341,"maximum_characters":180000,"character_comparison":"strictly_less_than","final_responses_request":{"serialized_characters":88133,"serialized_utf8_bytes":96819,"maximum_utf8_bytes":200000,"byte_comparison":"strictly_less_than","body_sha256":"2b7a098519070f3495edf42732008b0b3551c28cf94bdf04651d260f0ab9ff12","contains_model":true,"contains_instructions":true,"contains_input":true,"contains_tools":true,"contains_text_json_schema":true,"validation_scope":"exact UTF-8 byte gate and minimum Responses structure; no external model call was made"}},
  "limitations":["参考成片只提供正向保留模式，不能推断作者真实删片偏好。","人工画面未确认 speed ramp、精确倍率、复杂转场机制、独立音效或逐拍剪切。","未执行 OCR，字幕、价格、天气、地点、项目和片尾文字仍需人工复核。","音乐仅有机器分类，不声明曲名、BPM、ducking 或音乐因果。","费用、天气、动物、摄影、住宿和当地生活信息需独立核验。","严寒、海上、骑马、野生动物、驾驶和航拍具有现实风险，本 Study 不构成安全建议。"]
}
