{
  "schema_version":"1.0",
  "study_id":"technique-study-bilibili-BV1Sv421k7pS-v1",
  "generated_at":"2026-08-15T16:00:00+08:00",
  "source":{"source_id":"bilibili-BV1Sv421k7pS","url":"https://www.bilibili.com/video/BV1Sv421k7pS/","title":"和女朋友一起向已婚UP主学习如何谈恋爱！","duration_sec":1370.666},
  "analysis_evidence":{"proxy_dual_stream_full_decode_exit_code":0,"video_duration_sec":1370.666,"shot_count":116,"event_count":13,"audio_segment_count":252,"transcript_segment_count":987,"transcript_word_count":4424,"asr_provider":"faster-whisper","asr_model":"small","asr_language":"zh","asr_last_trusted_dialogue_end_sec":1363.01,"asr_dialogue_coverage_ratio":0.994414,"asr_tail_gap_sec":7.656,"event_review_contact_sheet_count":13,"manual_review_ranges":[[0.0,293.293],[293.293,718.719],[718.719,1079.68],[1079.68,1370.666]],"manual_review_focus":["opening-and-question-ladder","two-couple-contrast","midpoint-couple-game","travel-housework-and-growth","relationship-conclusion-and-tail"],"manual_effect_result":"人工联系表确认固定四人宽景、底部对白字幕、稀疏问题标题与答案标签；未确认 speed ramp、精确倍率、复杂转场机制、独立音效、曲名、BPM、ducking 或逐拍剪切。"},
  "opening_recipe":{"total_reviewed_sec":71.471,"phases":[{"start_sec":0.0,"end_sec":19.0,"function":"固定四人宽景先交代春节轻松聊天和两对情侣的关系阶段差异。"},{"start_sec":19.0,"end_sec":45.0,"function":"由新情侣明确向已婚或长期情侣提问，把闲聊转为经验对照。"},{"start_sec":45.0,"end_sec":71.471,"function":"从初见与外貌等轻问题进入第一轮具体案例，让人物反应而非剪辑花活承担吸引力。"}],"metrics":{"opening_15_sec_shot_count":4,"opening_15_sec_average_shot_sec":4.112,"opening_event_count":1},"rule":"多人谈话开场先交代参与者关系与提问方向，再从低压力、可讲具体故事的问题进入，避免直接用抽象价值判断压住人物。"},
  "narrative_model":{"premise":"两对处于不同关系阶段的情侣围绕相识、公开关系、手机与前任、吵架、爱与被爱等问题交换具体经验；中段以默契猜词游戏释放讨论密度，后半转向长途旅行、经济家务、工作分配、共同成长与关系厌倦，最终以经验不可替代普遍答案和‘自己开心就好’收束。","beats":["参与者关系与提问任务","初见、外貌和公开关系","手机、前任、争吵与爱被爱","情侣默契猜词游戏","未来节点与长途旅行","经济、家务和工作分配","共同成长与关系倦怠","反复重新爱上与个人经验边界"],"rule":"关系对谈按轻问题到重问题递进，并让两对人物各自用具体案例回应；游戏只作为中段换气，最终结论必须保留差异和个人经验边界。"},
  "scenic_model":{"preferred_sequence":["稳定四人全景建立座位与关系","在发言和抢话中保留同框反应","游戏段保留题目、猜测和揭晓连续性","结尾以短暂环境或收束镜头离开谈话桌"],"observed_ranges":[[0.0,1309.576],[1309.576,1370.666]],"rule":"固定机位对谈的视觉价值在同框关系、眼神和抢话反应，不应为了制造节奏频繁切掉完整交流过程。"},
  "music_model":{"music_likely_ratio":0.0259,"evidence_status":"audio-classification-and-manual-visual-review-only","visual_candidates":["问题段之间的短换气","游戏进入或揭晓处","结尾离席与收束"],"rule":"以对白清晰和自然停顿为主，音乐只适合承担章节换气或结尾收束；不声明曲名、BPM、ducking 数值或逐拍因果。"},
  "subtitle_model":{"base_style":"稳定底部对白字幕，在问题切换、游戏题目和答案揭晓时叠加稀疏的独立信息层。","emphasis_patterns":["问题标题帮助长对谈重新定位","游戏题目与答案标签区分猜测和揭晓","涉及未来、旅行、经济与家务时用短标题提示主题变化"],"rule":"对白字幕持续、问题与答案标签稀疏；未执行 OCR，字幕正文、说话人和图卡准确性仍需人工听校。"},
  "humor_model":{"event_chain":["先建立情侣知识或关系观点问题","保留犹豫、抢答、猜错和同伴即时反应","让当事人解释具体经历","由下一问题自然推进而非追加嘲讽"],"observed_ranges":[[182.249,608.609],[718.719,960.828]],"rule":"关系对谈笑点来自真实犹豫、默契偏差和熟人反应；不得用断章取义、隐私曝光或把个人关系经验包装成普遍结论换取笑点。"},
  "technique_observations":[
    {"observation_id":"obs-couple-talk-wide-shot-natural-reactions","technique_key":"humor-preserve-real-awkward-process","start_sec":0.0,"end_sec":1370.666,"category":"humor","trigger":"固定四人对谈的有效信息不仅在当前发言者，也在其他人的表情、抢话和停顿。","treatment":"以稳定四人宽景保留提问、犹豫、抢答、解释和同伴反应的连续过程，少量切换只用于章节或游戏状态变化。","confidence":0.97,"parameters":{"dominant_composition":"four_person_wide","reaction_continuity":true},"evidence":{"events":["event-001","event-004","event-008","event-012"],"manual_contact_sheets":true},"guardrails":["不能用错序反应制造冲突。","涉及隐私和关系边界的内容需当事人授权。"]},
    {"observation_id":"obs-couple-talk-light-to-deep-question-ladder","technique_key":"narrative-question-ladder-from-light-to-deep","start_sec":0.0,"end_sec":718.719,"category":"narrative","trigger":"连续关系讨论容易因一开始过重或长期停留在同一情绪而疲劳。","treatment":"从初见、外貌和公开关系等低压力问题，逐步推进到手机、前任、争吵及爱与被爱，每次先保留具体故事再进入观点。","confidence":0.98,"parameters":{"question_weight":"light_to_deep"},"evidence":{"events":["event-001","event-002","event-003","event-004","event-005","event-006","event-007"],"full_transcript":true,"manual_contact_sheets":true},"guardrails":["问题顺序不得歪曲实际回答语境。","敏感问题不应以逼问方式制造戏剧性。"]},
    {"observation_id":"obs-couple-talk-two-pair-contrast","technique_key":"narrative-two-couple-contrast-prevents-single-answer","start_sec":71.471,"end_sec":1309.576,"category":"narrative","trigger":"单一情侣的关系经验容易被误解为普遍答案。","treatment":"让新情侣和已婚或长期情侣分别回答同一问题，保留相同点、分歧和互相追问，再由主持人明确个人经验边界。","confidence":0.98,"parameters":{"perspective_count":2,"preserve_disagreement":true},"evidence":{"events":["event-002","event-005","event-009","event-012"],"manual_contact_sheets":true},"guardrails":["不得把任何一对的答案包装成关系规范。","剪辑不得隐藏关键限定条件。"]},
    {"observation_id":"obs-couple-talk-specific-before-advice","technique_key":"narrative-specific-example-before-relationship-advice","start_sec":182.249,"end_sec":1309.576,"category":"narrative","trigger":"抽象关系建议缺少可理解的情境和证据。","treatment":"先保留初见、争吵、旅行、经济、家务或工作分配的具体经历，再允许人物总结自己的做法和变化。","confidence":0.97,"parameters":{"example_before_summary":true},"evidence":{"events":["event-003","event-006","event-010","event-011","event-012"],"full_transcript":true},"guardrails":["具体案例仍是个人经验，不能泛化。","涉及财务、家庭和工作信息时需保护隐私。"]},
    {"observation_id":"obs-couple-talk-midpoint-game-release","technique_key":"humor-midpoint-couple-game-releases-discussion-density","start_sec":608.609,"end_sec":960.828,"category":"humor","trigger":"前半持续问答累积较高语言密度，需要改变互动规则而不离开关系主题。","treatment":"在中段插入情侣默契猜词游戏，完整保留出题、猜测、偏差、揭晓和反应，再回到未来与共同生活议题。","confidence":0.98,"parameters":{"midpoint_mode_change":"couple_guessing_game"},"evidence":{"events":["event-007","event-008","event-009"],"manual_contact_sheets":true},"guardrails":["游戏答案不能通过错序或删改伪造。","不以羞辱猜错方作为唯一笑点。"]},
    {"observation_id":"obs-couple-talk-travel-pressure-test","technique_key":"narrative-shared-task-reveals-relationship-process","start_sec":960.828,"end_sec":1193.293,"category":"narrative","trigger":"‘是否适合长期相处’需要能够显露分工、压力和修复方式的共同任务。","treatment":"用长途旅行和共同生活案例串联经济、家务、工作分配与冲突修复，保留过程和双方解释。","confidence":0.94,"parameters":{"shared_task":"long_trip_and_daily_life"},"evidence":{"events":["event-010","event-011"],"full_transcript":true,"manual_contact_sheets":true},"guardrails":["旅行只是片中人物的个人经验，不能声明为普遍关系测试。","安全、财务和关系建议需另行核验。"]},
    {"observation_id":"obs-couple-talk-rediscovery-close","technique_key":"narrative-long-relationship-repeated-rediscovery","start_sec":1193.293,"end_sec":1370.666,"category":"narrative","trigger":"长关系讨论若只给维持技巧，会忽略人物变化和关系不确定性。","treatment":"从共同成长、倦怠与未来节点推进到‘反复重新认识和爱上’，最后保留‘冷暖自知、自己开心就好’的个人边界收束。","confidence":0.97,"parameters":{"close_with_personal_boundary":true},"evidence":{"events":["event-012","event-013"],"full_transcript":true,"manual_contact_sheets":true},"guardrails":["不得把收束句解释为专业关系建议。","不得删掉对不同关系选择的尊重。"]},
    {"observation_id":"obs-couple-talk-subtitle-question-layer","technique_key":"subtitle-base-dialogue-with-sparse-context-layer","start_sec":0.0,"end_sec":1370.666,"category":"subtitle","trigger":"固定机位长对谈需要持续可读对白，同时让观众知道当前问题和游戏状态。","treatment":"保持底部对白字幕稳定，仅在问题切换、游戏题目和答案揭晓时增加稀疏标题或标签。","confidence":0.94,"parameters":{"base_layer":"bottom_dialogue","context_layer":"sparse_question_and_answer_labels"},"evidence":{"events":["event-001","event-008","event-012"],"manual_contact_sheets":true},"guardrails":["未执行 OCR，正文和说话人仍需人工听校。","标题层不得遮挡面部、手势或底部对白字幕。"]}
  ],
  "context_packet":{"packet_kind":"bounded_reference_context","serialized_characters":51872,"serialized_utf8_bytes":62814,"maximum_characters":180000,"character_comparison":"strictly_less_than","final_responses_request":{"serialized_characters":60015,"serialized_utf8_bytes":70957,"maximum_utf8_bytes":200000,"byte_comparison":"strictly_less_than","body_sha256":"7586d432f164bef2789ec11a484b738f812ed931e4abc412920e7f6de2e5524b","contains_model":true,"contains_instructions":true,"contains_input":true,"contains_tools":true,"contains_text_json_schema":true,"validation_scope":"exact UTF-8 byte gate and minimum Responses structure; no external model call was made"}},
  "limitations":["参考成片只提供正向保留模式，没有原始素材与成片映射，不能推断作者真实删片偏好。","人工画面未确认 speed ramp、精确倍率、复杂转场机制、独立音效、曲名、BPM、ducking 或逐拍因果。","未执行 OCR，字幕、问题标题、答案标签和片尾文字仍需人工听校。","关系、婚姻、旅行、财务、家务和共同成长内容均为片中人物个人经验，不能作为普遍或专业建议。","私人影像、关系细节、参与者身份与对话公开需确认授权和语境。","固定机位和低切换频率是该成片的正向呈现证据，不代表原始素材中不存在被删除的镜头。"]
}
