{
  "schema_version": "1.0",
  "study_id": "technique-study-bilibili-BV1UtsEzVEwF-v1",
  "generated_at": "2026-08-15T09:00:00Z",
  "source": {"source_id": "bilibili-BV1UtsEzVEwF", "url": "https://www.bilibili.com/video/BV1UtsEzVEwF/", "title": "这还是美国吗？给我干哪来了｜新奥尔良", "duration_sec": 1155.391667},
  "analysis_evidence": {"proxy_dual_stream_full_decode_exit_code": 0, "video_duration_sec": 1155.391667, "shot_count": 387, "event_count": 16, "audio_segment_count": 218, "transcript_segment_count": 535, "transcript_word_count": 3442, "asr_provider": "faster-whisper", "asr_model": "small", "asr_language": "zh", "asr_last_trusted_dialogue_end_sec": 1155.1, "asr_dialogue_coverage_ratio": 0.999748, "asr_tail_gap_sec": 0.291667, "event_review_contact_sheet_count": 16, "manual_review_ranges": [[0.0, 311.9], [311.9, 564.9], [564.9, 791.2], [791.2, 1062.0], [1062.0, 1155.391667]], "manual_review_focus": ["five-senses-opening", "history-street-and-food", "swamp-action-and-reaction", "jazz-live-performance", "city-thesis-ending"], "manual_effect_result": "未从人工画面证据确认 speed ramp、精确倍率、复杂转场机制、独立音效或逐拍剪切。"},
  "opening_recipe": {"total_reviewed_sec": 86.7, "phases": [{"start_sec": 0.0, "end_sec": 18.0, "function": "用‘新奥尔良烤翅’误解和快速城市证据制造熟悉名称与真实地点的反差。"}, {"start_sec": 18.0, "end_sec": 58.0, "function": "以爵士、小龙虾、港口、奴隶贸易和多族群历史说明城市复杂性。"}, {"start_sec": 58.0, "end_sec": 86.7, "function": "给出五感路线、明信片互动和‘最不美国的美国城市’主问题。"}], "metrics": {"opening_15_sec_shot_count": 7, "opening_15_sec_average_shot_sec": 2.264, "opening_event_count": 1}, "rule": "陌生城市开场可先拆掉一个流行误解，再用有限感官路线和历史矛盾建立探索任务；轻笑点不能冲淡严肃历史。"},
  "narrative_model": {"premise": "影片以五感和‘最不美国的美国城市’为问题，从港口与殖民历史进入法语区视觉、混合菜系味觉、沼泽触觉与爵士听觉，通过当地人互动和主持反应展示文化碰撞，最后把美国故事从钢铁森林和国家公园扩展到不同族群、苦难与创造的融合。", "beats": ["开场拆解烤翅误解并提出五感任务", "游戏地点与百年电车进入法语区", "城市符号和历史说明多文化来源", "美食制作、试吃与小龙虾来源", "沼泽行程和鳄鱼人物互动", "日落爵士邮轮完成听觉转折", "爵士街现场与随机入店", "回到美国故事与文化融合命题"], "rule": "多主题城市片可用感官章节做结构骨架，每章都包含背景、现场行动、当地人或物的回应和主持结论，结尾再把感官体验提升为城市命题。"},
  "scenic_model": {"preferred_sequence": ["地点或感官任务入场", "宽景交代街区、河流或沼泽尺度", "建筑、食物、动物、乐器和人物细节回答功能", "保留主持和当地人的真实反应", "以照片候选或现场声音形成章节结果"], "observed_ranges": [[86.7, 239.0], [311.9, 564.9], [564.9, 791.2], [791.2, 1062.0]], "rule": "城市景观要由交通、饮食、湿地和现场音乐的使用过程成立；美景必须保留人物尺度、安全边界和历史语境。"},
  "music_model": {"music_likely_ratio": 0.029, "evidence_status": "machine_audio_classification_plus-visible-live-performance", "visual_candidates": ["爵士邮轮日落", "Frenchmen Street 乐手", "酒吧即兴演出", "城市片尾"], "rule": "联系表确认现场乐手和演出空间，但不据此声明具体曲目、BPM、ducking、录音来源或逐拍剪切。"},
  "subtitle_model": {"base_style": "底部居中浅色对白字幕配深色描边，地点、历史、食物、人物、感官章节和照片编号使用独立信息层。", "emphasis_patterns": ["五感和 part 标题明确章节", "历史和外语名词使用稀疏资料卡", "照片候选保留编号和拍摄信息", "爵士人物与地点用简短识别层"], "rule": "多语言与事实密集时保持对白层稳定，把来源、章节、地点和互动编号分层；未执行 OCR，文字准确性仍需人工听校。"},
  "humor_model": {"event_chain": ["建立城市刻板印象或具体体验任务", "保留误解、双关、试吃失败和临场互动", "让同行或当地人即时回应", "回到食物、历史、动物或音乐解释"], "observed_ranges": [[0.0, 239.0], [311.9, 564.9], [633.7, 791.2], [976.8, 1062.0]], "rule": "旅行笑点来自文化误解和真实反应；当地人、族群历史、食物和动物安全不得成为贬损对象。"},
  "technique_observations": [
    {"observation_id": "obs-nola-opening-misconception-senses", "technique_key": "opening-contrast-thesis-with-concrete-question", "start_sec": 0.0, "end_sec": 86.7, "category": "opening_montage", "trigger": "观众可能只从烤翅、游戏或爵士标签认识新奥尔良。", "treatment": "先用烤翅误解制造反差，再并列港口、历史、族群、食物和爵士证据，最后给出五感路线和城市问题。", "confidence": 0.98, "parameters": {"sense_count": 5}, "evidence": {"event_id": "event-001", "manual_contact_sheet": true}, "guardrails": ["奴隶贸易与族群历史不能作为轻松猎奇素材。", "开场列出的五感必须在正文兑现。"]},
    {"observation_id": "obs-nola-five-sense-chapter-spine", "technique_key": "narrative-sensory-chapters-build-place-thesis", "start_sec": 0.0, "end_sec": 1155.391667, "category": "narrative", "trigger": "城市历史、美食、湿地和音乐材料跨度大。", "treatment": "用视觉、味觉、触觉和听觉等感官章节组织街区、餐厅、沼泽和爵士现场，每章回收一个城市特征。", "confidence": 0.99, "parameters": {"chapter_spine": "senses"}, "evidence": {"events": ["event-001", "event-002", "event-004", "event-008", "event-009", "event-012", "event-015"], "full_transcript": true}, "guardrails": ["感官分类不能抹平历史因果和族群差异。", "章节名不得替代事实来源。"]},
    {"observation_id": "obs-nola-game-reference-to-city", "technique_key": "graphic-reference-frame-to-live-location-match", "start_sec": 86.7, "end_sec": 169.8, "category": "graphic", "trigger": "游戏玩家熟悉虚构圣丹尼斯，但未必知道现实原型。", "treatment": "以游戏地点为识别入口，切到杰克逊广场、街车和法语区实景，再说明现实城市的历史与日常。", "confidence": 0.95, "parameters": {"fiction_reference_before_live_place": true}, "evidence": {"event_id": "event-002", "manual_contact_sheet": true}, "guardrails": ["游戏素材授权和取景对应关系需独立核验。", "虚构作品不能替代现实历史。"]},
    {"observation_id": "obs-nola-food-process-reaction", "technique_key": "narrative-food-process-tasting-reaction", "start_sec": 239.0, "end_sec": 564.9, "category": "narrative", "trigger": "混合菜系若只列菜名，无法体现港口文化和真实口感。", "treatment": "先解释多文化来源，再保留餐厅制作、上菜、同行试吃、好恶分歧、小龙虾来源和鳄鱼肉失败反应。", "confidence": 0.97, "parameters": {"context_process_reaction": true}, "evidence": {"events": ["event-004", "event-005", "event-006", "event-007", "event-008"], "manual_contact_sheets": true}, "guardrails": ["菜系来源、物种和迁移史需独立核验。", "不把个人口味概括为地方食物结论。"]},
    {"observation_id": "obs-nola-local-joke-interaction", "technique_key": "humor-small-local-encounter-validates-place", "start_sec": 169.8, "end_sec": 239.0, "category": "humor", "trigger": "NOLA 和 N.O.P.D. 等城市符号需要现场语境。", "treatment": "让主持人在街头发现双关、进店询问并与工作人员交流，以真实互动验证本地幽默而非旁白硬讲。", "confidence": 0.96, "parameters": {"local_response_required": true}, "evidence": {"event_id": "event-003", "manual_contact_sheet": true}, "guardrails": ["警务和治安笑话不能替代现实安全信息。", "当地人互动需保留同意和完整语境。"]},
    {"observation_id": "obs-nola-swamp-guide-action-payoff", "technique_key": "scenic-guide-search-reaction-before-explanation", "start_sec": 564.9, "end_sec": 791.2, "category": "scenic", "trigger": "沼泽和鳄鱼容易被剪成单纯危险奇观。", "treatment": "保留向导搜寻、投喂、个体识别、主持反应和失败尝试，再用宽景、逆光和水面细节揭示沼泽之美。", "confidence": 0.97, "parameters": {"guide_action_before_reveal": true}, "evidence": {"events": ["event-009", "event-010", "event-011"], "manual_contact_sheets": true}, "guardrails": ["野生动物安全和投喂规范需独立核验。", "不能为画面要求危险接触。"]},
    {"observation_id": "obs-nola-live-music-place-proof", "technique_key": "narrative-live-performance-validates-place-identity", "start_sec": 791.2, "end_sec": 1062.0, "category": "narrative", "trigger": "‘爵士发源地’若只靠旁白会变成标签。", "treatment": "从日落邮轮的现场演出进入 Frenchmen Street 和随机酒吧，以乐手、观众、空间和主持停留反应证明音乐仍是城市日常。", "confidence": 0.98, "parameters": {"multiple_live_venues": true}, "evidence": {"events": ["event-012", "event-013", "event-014"], "manual_contact_sheets": true}, "guardrails": ["演出、乐手身份和音乐授权需独立核验。", "不由画面推断具体曲名或完整录音来源。"]},
    {"observation_id": "obs-nola-sponsor-demonstration-across-missions", "technique_key": "narrative-sponsor-demonstration-with-host-friction", "start_sec": 0.0, "end_sec": 976.8, "category": "narrative", "trigger": "旅拍手机植入可能中断城市叙事。", "treatment": "将街拍编号、沼泽长焦、船上防抖、夜景和现场照片选择嵌入五感任务，并保留主持对使用条件的说明。", "confidence": 0.94, "parameters": {"story_missions_demonstrate_product": true}, "evidence": {"events": ["event-001", "event-008", "event-009", "event-011", "event-012", "event-013"], "manual_contact_sheets": true}, "guardrails": ["品牌关系、设备参数和样张需明确披露并独立验证。", "产品层不得遮挡历史、动物安全或乐手主体。"]},
    {"observation_id": "obs-nola-dialogue-fact-chapter-layers", "technique_key": "subtitle-base-dialogue-with-sparse-context-layer", "start_sec": 0.0, "end_sec": 1155.391667, "category": "subtitle", "trigger": "中英文地点、人名、历史、菜名、动物、感官章节和照片编号密集。", "treatment": "保持稳定底部对白字幕，将地点、章节、历史来源、人物、菜名、物种和照片编号放入独立稀疏层。", "confidence": 0.92, "parameters": {"base_position": "bottom_center", "ocr_verified": false}, "evidence": {"manual_contact_sheet_count": 16}, "guardrails": ["外语名、历史、物种和菜单仍需人工听校与事实核验。", "信息层不得遮挡现场乐手、动物动作和食物细节。"]}
  ],
  "context_packet": {"packet_kind": "bounded_reference_context", "serialized_characters": 69336, "serialized_utf8_bytes": 77396, "maximum_characters": 180000, "character_comparison": "strictly_less_than", "final_responses_request": {"serialized_characters": 79935, "serialized_utf8_bytes": 87995, "maximum_utf8_bytes": 200000, "byte_comparison": "strictly_less_than", "body_sha256": "a658c21f9bfeb728a24f1f4eab6a7aed87842d5a987b1936d84e0793366bc05d", "contains_model": true, "contains_instructions": true, "contains_input": true, "contains_tools": true, "contains_text_json_schema": true, "validation_scope": "exact UTF-8 byte gate and minimum Responses structure; no external model call was made"}},
  "limitations": ["参考成片只提供正向保留模式，不能推断作者真实删片偏好。", "人工画面未确认 speed ramp、精确倍率、复杂转场机制、独立音效或逐拍剪切。", "未执行 OCR，字幕、地点、人名、年份、菜单、物种和资料卡仍需人工复核。", "联系表确认现场演出，但不声明具体曲名、BPM、ducking、完整录音来源或音乐因果。", "奴隶贸易、殖民史、族群、菜系、动物、城市安全和产品性能需独立核验。", "野生动物接触、酒精和夜间活动具有现实风险，本 Study 不构成安全建议。"]
}
