{
  "schema_version":"1.0",
  "study_id":"technique-study-bilibili-BV1zYSvBHE3U-v1",
  "generated_at":"2026-08-15T11:00:00Z",
  "source":{"source_id":"bilibili-BV1zYSvBHE3U","url":"https://www.bilibili.com/video/BV1zYSvBHE3U/","title":"用一只帆船也可以环游世界？","duration_sec":2045.802333},
  "analysis_evidence":{"proxy_dual_stream_full_decode_exit_code":0,"video_duration_sec":2045.802333,"shot_count":593,"event_count":23,"audio_segment_count":446,"transcript_segment_count":1253,"transcript_word_count":6353,"asr_provider":"faster-whisper","asr_model":"small","asr_language":"zh","asr_last_trusted_dialogue_end_sec":2045.11,"asr_dialogue_coverage_ratio":0.999662,"asr_tail_gap_sec":0.692333,"event_review_contact_sheet_count":23,"manual_review_ranges":[[0.0,419.9],[419.9,874.7],[874.7,1389.4],[1389.4,1771.7],[1771.7,2045.802333]],"manual_review_focus":["opening-and-arc-mission","safety-and-sailing-training","crew-skills-and-life-stories","shipboard-community","desert-sea-payoff-and-thesis"],"manual_effect_result":"未从人工画面证据确认 speed ramp、精确倍率、复杂转场机制、独立音效或逐拍剪切。"},
  "opening_recipe":{"total_reviewed_sec":137.3,"phases":[{"start_sec":0.0,"end_sec":31.0,"function":"用‘帆船环游世界’问题、跨洋航线和船队画面建立巨大任务。"},{"start_sec":31.0,"end_sec":81.0,"function":"把加那利、三毛地点、ARC 起点和首次全中国船队连接起来。"},{"start_sec":81.0,"end_sec":137.3,"function":"限定两天从零学习帆船并亲自驶向海与沙漠交界的可执行目标。"}],"metrics":{"opening_15_sec_shot_count":10,"opening_15_sec_average_shot_sec":1.859,"opening_event_count":1},"rule":"技能探险片先展示终极尺度，再把任务缩小为本集可验证的学习与到达目标；宏大梦想必须由具体船员、装备和行动承载。"},
  "narrative_model":{"premise":"影片以首次全中国船队参加跨大西洋活动为入口，主持人在两天内学习安全、升帆、绳结、掌舵、潜水和海钓；每项技能同时引出船员为何上船、如何生活和彼此依赖，最终驾船到达撒哈拉沙漠与大海交界，并把环球目标转化为每个人寻找远方的生命课题。","beats":["全球帆船与中国船队任务","登船、空间和安全介绍","升帆与掌舵训练","船长和船员选择航海的原因","潜水、做饭和海钓展示互补技能","晚餐与船上家庭感","清晨驶向沙漠海岸并登陆","从三毛、自由与远方回到环球目标"],"rule":"团队技能片用‘任务学习—成员能力—个人原因—共同生活’交替推进，让技术解释和人物故事互相证明，最后以实际到达回收开场。"},
  "scenic_model":{"preferred_sequence":["航线或地点图建立尺度","船体、绳索、帆和设备细节解释行动","人物在风浪中操作并接受反馈","海面、日落、船队和沙丘宽景给环境回报","以登陆和人物反思完成地点意义"],"observed_ranges":[[137.3,989.1],[1471.1,1878.4],[1878.4,2045.802333]],"rule":"海上美景必须与航行操作、风浪、安全和船员劳动共同出现；沙海 payoff 需要真实驶近和登陆过程。"},
  "music_model":{"music_likely_ratio":0.0232,"evidence_status":"machine_audio_classification_only","visual_candidates":["船队开场","升帆与掌舵","日落晚餐","沙海登陆和片尾"],"rule":"不由联系表声明曲名、BPM、ducking、逐拍剪切或音乐因果。"},
  "subtitle_model":{"base_style":"底部居中对白字幕配深色描边，航线、成员、技能、安全设备、深度和章节标题使用独立信息层。","emphasis_patterns":["地图动画解释跨洋路线","技能和设备名随操作短暂出现","成员身份与专长在首次出场标注","海沙地点和引用独立成层"],"rule":"技术、外语、数字和安全信息与对白分层；未执行 OCR，文字准确性仍需人工听校。"},
  "humor_model":{"event_chain":["建立严肃技能任务","保留厕所故障、晕船、拉帆失败、绳结玩笑、钓鱼和船员互损","由专业成员纠正并继续教学","回到安全、技能或人物选择"],"observed_ranges":[[137.3,874.7],[989.1,1471.1],[1471.1,1771.7]],"rule":"船上笑点来自真实协作和学习失败；潜水、落水、风浪、钩具与动物安全不得被弱化。"},
  "technique_observations":[
    {"observation_id":"obs-sailing-opening-global-to-two-day-mission","technique_key":"opening-place-thesis-to-concrete-mission","start_sec":0.0,"end_sec":137.3,"category":"opening_montage","trigger":"环球帆船尺度太大，单集难以建立可验证目标。","treatment":"先展示全球航线与中国船队，再限定两天从零学习并亲自驶向海沙交界。","confidence":0.98,"parameters":{"global_to_local_task":true},"evidence":{"events":["event-001","event-002"],"manual_contact_sheets":true},"guardrails":["赛事、船队与航线信息需独立核验。","不能暗示主持人已具备跨洋能力。"]},
    {"observation_id":"obs-sailing-safety-before-action","technique_key":"narrative-safety-brief-before-risk-action","start_sec":236.7,"end_sec":419.9,"category":"narrative","trigger":"海上拍摄和训练涉及落水、风浪与设备风险。","treatment":"在升帆和驾驶前展示国旗礼仪、航线、安全绳、救生衣、定位与固定机位，再进入实际操作。","confidence":0.97,"parameters":{"safety_before_action":true},"evidence":{"events":["event-004","event-005"],"manual_contact_sheets":true},"guardrails":["安全设备能力和操作规范需专业核验。","不得为镜头越过船员指令。"]},
    {"observation_id":"obs-sailing-expert-demo-attempt-feedback","technique_key":"narrative-expert-demo-attempt-feedback","start_sec":419.9,"end_sec":989.1,"category":"narrative","trigger":"升帆、绞盘、绳结和掌舵知识仅靠讲解难以理解。","treatment":"由船长示范，主持人实际尝试、失败和提问，再由专家即时纠正，最终独立保持航向。","confidence":0.99,"parameters":{"demo_attempt_feedback":true},"evidence":{"events":["event-006","event-007","event-008","event-009","event-010","event-011"],"manual_contact_sheets":true},"guardrails":["教学片段不替代正式培训。","保留手套、体力和风况等限制。"]},
    {"observation_id":"obs-sailing-skill-opens-crew-story","technique_key":"narrative-skill-demonstration-opens-person-story","start_sec":672.7,"end_sec":1471.1,"category":"narrative","trigger":"多人船队容易只剩身份名单。","treatment":"从绳结、航线规划、做饭、潜水和海钓分别进入成员的职业、性格、上船原因和生活哲学。","confidence":0.98,"parameters":{"skill_as_character_entry":true},"evidence":{"events":["event-009","event-011","event-012","event-013","event-014","event-015","event-016"],"full_transcript":true},"guardrails":["成员故事不由主持旁白替代本人原声。","专业资质与经历需独立核验。"]},
    {"observation_id":"obs-sailing-community-work-meal","technique_key":"narrative-shared-work-meal-validates-community","start_sec":989.1,"end_sec":1771.7,"category":"narrative","trigger":"环球梦想需要证明团队如何共同生活。","treatment":"保留做饭、潜水准备、钓鱼、清理、晚餐、庆祝和次日早起，把互补劳动与关系呈现为远航基础。","confidence":0.98,"parameters":{"shared_labor_before_celebration":true},"evidence":{"events":["event-012","event-013","event-014","event-015","event-016","event-017","event-018","event-019"],"manual_contact_sheets":true},"guardrails":["不把成员劳动浪漫化为无风险生活。","食物、酒精和海钓安全需保留。"]},
    {"observation_id":"obs-sailing-sea-desert-arrival-payoff","technique_key":"scenic-arrival-wide-detail-human-reaction","start_sec":1671.7,"end_sec":1878.4,"category":"scenic","trigger":"开场承诺大海与沙漠交界。","treatment":"从清晨航行、远望沙丘、换登陆艇、靠岸到登沙丘完整推进，以航拍、脚印和人物反应完成实际到达。","confidence":0.99,"parameters":{"arrival_process_visible":true},"evidence":{"events":["event-019","event-020","event-021"],"manual_contact_sheets":true},"guardrails":["沙源、地点和自然解释需独立核验。","登陆、艇与沙丘活动遵守当地规则。"]},
    {"observation_id":"obs-sailing-action-camera-risk-task","technique_key":"narrative-sponsor-demonstration-with-host-friction","start_sec":309.1,"end_sec":1671.7,"category":"narrative","trigger":"运动相机植入若只讲参数，会中断帆船人物线。","treatment":"把固定机位、防水、夜景和潜水测试嵌入真实船上任务，并保留风险、设备限制与专业成员操作。","confidence":0.93,"parameters":{"product_test_inside_story_task":true},"evidence":{"events":["event-005","event-013","event-017"],"manual_contact_sheets":true},"guardrails":["品牌关系、深度与设备性能需独立验证。","不得为了测试突破厂商或潜水安全范围。"]},
    {"observation_id":"obs-sailing-dialogue-skill-map-layers","technique_key":"subtitle-base-dialogue-with-sparse-context-layer","start_sec":0.0,"end_sec":2045.802333,"category":"subtitle","trigger":"航线、赛事、成员、外语、技能、设备、距离与引用密集。","treatment":"保持底部对白层，将地图、成员身份、技能、安全设备、数字和引用放入独立稀疏层。","confidence":0.92,"parameters":{"base_position":"bottom_center","ocr_verified":false},"evidence":{"manual_contact_sheet_count":23},"guardrails":["技术、外语、数字和引用仍需人工听校与事实核验。","图层不得遮挡绳索、控制台、潜水信号和登陆动作。"]}
  ],
  "context_packet":{"packet_kind":"bounded_reference_context","serialized_characters":87982,"serialized_utf8_bytes":103112,"maximum_characters":180000,"character_comparison":"strictly_less_than","final_responses_request":{"serialized_characters":100391,"serialized_utf8_bytes":115521,"maximum_utf8_bytes":200000,"byte_comparison":"strictly_less_than","body_sha256":"a81c8961157a273b2c7f3e77704124f69fbda03490f429bc51be4d69a8adc318","contains_model":true,"contains_instructions":true,"contains_input":true,"contains_tools":true,"contains_text_json_schema":true,"validation_scope":"exact UTF-8 byte gate and minimum Responses structure; no external model call was made"}},
  "limitations":["参考成片只提供正向保留模式，不能推断作者真实删片偏好。","人工画面未确认 speed ramp、精确倍率、复杂转场机制、独立音效或逐拍剪切。","未执行 OCR，字幕、地图、赛事、成员、技术、数字和引用仍需人工复核。","音乐仅有机器分类，不声明曲名、BPM、ducking 或音乐因果。","航海、签证、潜水、设备、防水深度、海钓和历史文学信息需独立核验。","帆船、潜水、海钓、登陆和海上拍摄具有现实风险，本 Study 不构成培训或安全建议。"]
}
